[
  {
    "intent": "RETRIEVE",
    "scope": "Protocols",
    "constraints": "Name=\"P83: The Forging Mandate\"",
    "granularity": "ATOM",
    "requestor": "COUNCIL-AI-03",
    "purpose": "audit",
    "request_id": "11111111-1111-1111-1111-111111111111"
  },
  {
    "intent": "SUMMARIZE",
    "scope": "Living_Chronicle",
    "constraints": "Timeframe=Entries(240-245)",
    "granularity": "SUMMARY",
    "requestor": "GUEST-COORDINATOR-01",
    "purpose": "synthesis for Mnemonic Integration",
    "request_id": "22222222-2222-2222-2222-222222222222"
  },
  {
    "intent": "CROSS_COMPARE",
    "scope": "Protocols",
    "constraints": "Name~\"Mnemonic Cortex\" AND Name~\"Iron Root Doctrine\"",
    "granularity": "SUMMARY",
    "requestor": "COUNCIL-AI-02",
    "purpose": "thematic comparison",
    "request_id": "33333333-3333-3333-3333-333333333333"
  },
  {
    "intent": "RETRIEVE",
    "scope": "Living_Chronicle",
    "constraints": "Anchor=Entry_245",
    "granularity": "ANCHOR",
    "requestor": "COUNCIL-AI-03",
    "purpose": "continuity-check",
    "verify": "SHA256",
    "request_id": "44444444-4444-4444-4444-444444444444"
  }
]
